titleJapanese,titleEnglish,genre,CEFR,japanese,english,hiragana
パチンコ,Pachinko,culture,B1,パチンコは日本でとても人気のある娯楽の一つです。パチンコ店は全国に多くあり、大きな駅や都市だけでなく、小さな町や郊外でも見つけることができます。店内にはたくさんのパチンコ台が並んでおり、利用者はその台を使って遊びます。パチンコは基本的に小さな金属の玉を使うゲームです。利用者は機械にお金を入れて玉を手に入れ、その玉を使って遊びます。目的は、玉をうまく穴に入れて、より多くの玉を獲得することです。玉を増やすと、特別な景品や商品券と交換することができる仕組みになっています。ただし、日本ではギャンブルが禁止されているため、直接現金をもらうことはできません。パチンコは娯楽として楽しまれる一方で、時には問題も起こります。例えば、長時間遊びすぎてお金を使いすぎたり、生活に悪影響を与えたりすることがあります。そのため、近年では「適度に遊びましょう」というキャンペーンが行われています。パチンコは日本独特の文化の一つですが、観光客にとっては少し複雑に感じるかもしれません。それでも、日本に来た際には一度体験してみるのも面白いかもしれません。ルールを理解して、楽しみながら遊ぶのが大切です。,"Pachinko is a very popular pastime in Japan. Pachinko parlors can be found throughout Japan, not only in large train stations and cities, but also in small towns and suburbs. Inside the parlor are many pachinko tables, which are used by the players to play. Pachinko is basically a game that uses small metal balls. The player puts money into the machine to get the balls, which are then used to play with. The objective is to get more balls by successfully placing them in the holes. The system allows the user to exchange the more balls for special prizes or gift certificates. However, since gambling is prohibited in Japan, no direct cash rewards are available. While pachinko is enjoyed as a pastime, it can sometimes cause problems. For example, people sometimes play for too long and spend too much money, or it can have a negative impact on their lives. For this reason, a campaign has been launched in recent years to encourage people to play in moderation. Pachinko is a part of Japan's unique culture, which may seem a bit complicated for tourists. Nevertheless, it may be interesting to experience it once when you come to Japan. It is important to understand the rules and have fun while playing.",
ハンナ・アーレント,Hannah Arendt,biography,C1,ハンナ・アーレントは、ドイツ生まれの政治哲学者であり、20世紀の思想に多大な影響を与えた人物です。彼女の研究は権力、全体主義、そして公共領域における人間の行動に焦点を当てています。アーレントはナチス政権の迫害を受けてアメリカへ亡命し、その後も一貫して人間の自由と政治的行為の意味について深く考察しました。彼女の代表的な著作『全体主義の起源』では、20世紀におけるナチズムとスターリニズムのような全体主義体制の構造と歴史的背景を分析しました。アーレントは、全体主義が孤立した個人を利用して権力を維持する仕組みを暴き出し、人間性と自由を守るためには公共領域での対話が不可欠であると主張しました。また、彼女のもう一つの重要な著作『人間の条件』では、人間の活動を「労働」「仕事」「行為」という三つのカテゴリーに分類し、とりわけ「行為」が他者との関係を通じて新たな現実を創造する能力を持つ点を強調しました。アーレントにとって、自由とは公共空間で他者とともに行為することにほかなりませんでした。さらに、アーレントはアイヒマン裁判を取材し、『イェルサレムのアイヒマン―悪の陳腐さについての報告』を執筆しました。この中で彼女は、「悪の陳腐さ」という概念を提唱し、個人が深く考えることなく体制に従うことで恐ろしい行為が可能になることを指摘しました。この議論は大きな論争を引き起こし、現在も倫理や責任についての議論において重要なテーマとなっています。ハンナ・アーレントの思想は、単なる学問的な枠を超え、現代の政治や社会問題を考える上で貴重な視座を提供しています。彼女の理論は、人間の尊厳や自由の本質を問い直すための道筋を示しており、時代を超えて多くの人々に影響を与え続けています。,"Hannah Arendt was a German-born political philosopher who has had a profound influence on 20th century thought. Her work focused on power, totalitarianism, and human behavior in the public sphere. Arendt defected to the United States following the persecution of the Nazi regime and consistently reflected deeply on the meaning of human freedom and political action. In her seminal work, The Origins of Totalitarianism, she analyzed the structure and historical background of totalitarian regimes such as Nazism and Stalinism in the 20th century. Arendt exposed how totalitarianism uses isolated individuals to maintain power and argued that dialogue in the public sphere is essential to protect humanity and freedom. In her other important work, The Human Condition, she divided human activity into three categories: work, work, and action, emphasizing in particular the ability of action to create new realities through relationships with others. For Arendt, freedom was nothing other than to act with others in public space. In addition, Arendt covered the Eichmann trial and wrote Eichmann in Jerusalem, A Report on the Banality of Evil. In it, she proposed the concept of the banality of evil and pointed out that individuals could commit terrible acts by following the regime without thinking deeply. This argument caused great controversy and remains an important theme in discussions of ethics and responsibility today. Hannah Arendt's ideas go beyond mere scholarship and provide a valuable perspective on contemporary political and social issues. Her theories provide a roadmap for questioning the nature of human dignity and freedom, and they continue to influence many people throughout the ages.",
ビートルズ,The Beatles,culture,A2,ビートルズは、イギリスの有名なバンドです。1960年代に世界中で人気になりました。メンバーは4人です。ジョン・レノン、ポール・マッカートニー、ジョージ・ハリスン、リンゴ・スターです。ビートルズはたくさんの有名な曲を作りました。「イエスタデイ」や「レット・イット・ビー」、「ヘイ・ジュード」などはとても人気があります。これらの曲は、今でも多くの人に聞かれています。ビートルズの音楽は、ロックだけでなく、ポップやクラシックの要素もあります。そのため、さまざまな人に愛されています。また、彼らのスタイルや考え方も多くの人に影響を与えました。ビートルズは1970年に解散しましたが、今でも音楽の歴史でとても大切な存在です。彼らの音楽は、これからも多くの人に楽しまれるでしょう。,"The Beatles are a famous British band. They became popular around the world in the 1960s. There were four band members. John Lennon, Paul McCartney, George Harrison, and Ringo Starr. The Beatles wrote many famous songs. Songs like “Yesterday,” “Let It Be,” and “Hey Jude” are very popular. These songs are still heard by many people today. The Beatles' music is not only rock, but also has elements of pop and classical music. Because of this, they are loved by many different people. Their style and way of thinking also influenced many people. The Beatles broke up in 1970, but they are still a very important part of music history. Their music will continue to be enjoyed by many people.",
ヒーローの旅,The Hero’s Journey,fantasy,B1,ヒーローの旅は、物語の中でよく使われるテーマです。この構造は、主人公が自分の世界を離れ、冒険に出て、成長し、新しい知識や力を持って帰るという流れです。まず、主人公は「日常の世界」にいます。ここでは特別なことは起こりませんが、何か変化が必要だと感じる瞬間が訪れます。例えば、村が危機に陥ったり、未知の世界からの呼びかけを受けたりします。これを「冒険への呼びかけ」と言います。次に、主人公はその呼びかけを受け入れるかどうか迷います。しかし、導いてくれる助言者や師匠が現れ、その後、主人公は未知の世界へ踏み出します。この時、「試練」や「敵」と出会い、さまざまな困難を乗り越える必要があります。これらの試練を通して、主人公は強くなり、自分自身の弱さや恐怖に向き合います。最終的に、主人公は「最も重要な挑戦」に直面します。この挑戦を乗り越えた時、主人公は新しい力や知識を得ます。そしてその力を持ち帰り、日常の世界で人々を助けたり、自分の使命を果たしたりします。これが「ヒーローの旅」の完成です。この物語のパターンは、多くの映画や小説、伝説で見られます。例えば、『スター・ウォーズ』や『千と千尋の神隠し』もこの構造を使っています。ヒーローの旅は、私たち自身の人生にも当てはまることがあり、自分の成長や挑戦を考える良いきっかけになるでしょう。,"The hero's journey is a common theme in stories. The structure involves the hero leaving his world, going on an adventure, growing, and returning with new knowledge and powers. First, the hero is in the “everyday world”. Nothing special happens here, but moments come when he feels that something needs to change. For example, the village may be in danger, or he may receive a call from the unknown world. This is called a “call to adventure. Next, the protagonist is unsure whether to accept the call. However, an advisor or mentor appears to guide him, and he then steps out into the unknown. At this time, he encounters “trials” and “enemies” and must overcome various difficulties. Through these trials, the protagonist becomes stronger and faces his own weaknesses and fears. Finally, the protagonist faces the “most important challenge. When the protagonist overcomes this challenge, he or she gains new strength and knowledge. He then takes that power back to the everyday world to help people and fulfill his mission. This completes the “hero's journey. This narrative pattern can be found in many movies, novels, and legends. For example, “Star Wars” and “Spirited Away” also use this structure. The Hero's Journey can also apply to our own lives and can be a good starting point to consider our own growth and challenges.",
ピザ,Pizza,food,A2,ピザは、世界中で人気のある食べ物です。イタリアが発祥地ですが、今ではどの国でも食べることができます。ピザの生地の上に、トマトソース、チーズ、そしていろいろな具材をのせて焼きます。具材は、ペパロニ、きのこ、野菜、シーフードなど、好きなものを選ぶことができます。特に日本では、「照り焼きチキンピザ」や「マヨコーンピザ」のようなオリジナルの味も人気です。また、家で簡単に作れる冷凍ピザやピザパンも売られています。友達や家族と一緒にピザをシェアするのは楽しい時間です。パーティーや特別な日にもよく食べられます。あなたの好きなピザの味は何ですか？,"Pizza is a popular food all over the world. Although it originated in Italy, it is now available in all countries. It is made by baking a pizza dough topped with tomato sauce, cheese, and a variety of ingredients. The ingredients can be pepperoni, mushrooms, vegetables, seafood, or anything else you like. Especially in Japan, original flavors such as Teriyaki Chicken Pizza and Mayo Corn Pizza are also popular. Frozen pizzas and pizza pans that can be easily made at home are also sold. Sharing pizza with friends and family is a fun time. It is often eaten at parties and special occasions. What is your favorite pizza flavor?",
フェミニズム,Feminism,politics,B2,フェミニズムとは、男女平等を目指す思想や運動を指します。この考え方は、女性が男性と同じ権利や機会を持つべきだという理念に基づいており、歴史的にも多くの国で社会の変革を促してきました。日本でも、フェミニズムの影響を受けた動きが徐々に広がっていますが、まだ解決すべき課題が残っています。一つの課題は、職場における男女格差です。多くの企業では、依然として管理職に占める女性の割合が低く、昇進の機会が限られているケースがあります。また、育児や家事の負担が女性に偏ることも問題です。このような状況を改善するためには、柔軟な働き方や育児休暇の利用促進など、具体的な制度改革が必要です。また、日常生活における固定観念や偏見も大きな壁となっています。例えば、「女性らしさ」や「男性らしさ」といった性別に基づく期待が、個人の選択肢を制限することがあります。こうした考え方を変えるためには、教育の中で性別にとらわれない価値観を育てることが重要です。さらに、フェミニズムに対する誤解も少なくありません。一部の人々は、フェミニズムを「男性を批判する運動」と捉えることがありますが、実際には性別を問わず、全ての人が自由で平等な社会を実現することを目指しています。この誤解を解消し、建設的な議論を進めることが求められます。フェミニズムは、女性だけでなく、男性や他の性別の人々にも利益をもたらす運動です。全ての人が平等に尊重される社会を目指すために、一人ひとりがこのテーマについて考え、行動することが大切です。,"Feminism is an idea and movement that aims for gender equality. This idea is based on the principle that women should have the same rights and opportunities as men, and has historically promoted social change in many countries. In Japan, too, movements influenced by feminism are gradually spreading, but there are still issues that need to be resolved. One issue is the gender gap in the workplace. In many companies, the percentage of women in management positions remains low, and in some cases, opportunities for promotion are limited. Another problem is that the burden of childcare and housework is disproportionately placed on women. To improve this situation, specific system reforms are needed, such as promoting flexible work styles and the use of parental leave. Stereotypes and prejudices in daily life are also a major barrier. For example, gender-based expectations such as “femininity” and “masculinity” can limit an individual's options. To change these attitudes, it is important to foster gender-neutral values in education. Furthermore, there are many misconceptions about feminism. Some people may view feminism as a movement that criticizes men, when in fact it aims to achieve a free and equal society for all people, regardless of gender. This misunderstanding must be resolved to promote constructive discussion. Feminism is a movement that benefits not only women, but also men and people of other genders. It is important for each of us to think and act on this topic in order to achieve a society where all people are equally respected.",
プラセボ効果,The Placebo Effect,psychology,B2,プラセボ効果とは、実際には治療効果のない薬や治療法を受けた場合でも、患者が「効果がある」と信じることで症状が改善する現象を指します。この効果は医学や心理学の分野で広く研究されており、そのメカニズムについてはまだ完全には解明されていませんが、患者の期待や信念が脳や身体に影響を与えると考えられています。プラセボ効果の具体的な例として、偽薬を使った臨床試験があります。この試験では、被験者に実際の薬とプラセボ（偽薬）を与え、その効果を比較します。驚くべきことに、プラセボを服用した被験者の中にも症状が改善したと感じる人が多くいます。このことは、治療の成功に患者の心理状態が重要な役割を果たしていることを示しています。しかし、プラセボ効果には限界もあります。例えば、重篤な病気に対してはプラセボだけでは十分な効果を得ることは難しいです。また、患者がプラセボを「本物の薬」として与えられる場合、倫理的な問題が生じる可能性もあります。患者を意図的に欺くことは、信頼関係を損なうリスクがあるため、医療現場では慎重な対応が求められます。それでも、プラセボ効果は医療や心理療法において活用できる可能性があります。例えば、患者にポジティブな期待を持たせたり、信頼感を高めたりすることで、治療効果を増強させることができるかもしれません。さらに、プラセボ効果を研究することで、心と身体の関係についての理解が深まり、より効果的な治療法の開発につながる可能性があります。プラセボ効果は単なる「思い込み」の範囲を超え、人間の心理と生理の複雑なつながりを示す重要な現象です。その理解を深めることで、医療や健康の分野に新しい視点を提供できるでしょう。,"The placebo effect refers to the phenomenon in which symptoms improve when a patient believes that a drug or treatment is “effective,” even when it actually has no therapeutic effect. This effect has been extensively studied in the fields of medicine and psychology, and although the mechanism is not yet fully understood, it is believed that the patient's expectations and beliefs influence the brain and body. A specific example of the placebo effect is a clinical trial using a sham drug. In these trials, subjects are given actual drugs and placebos (fake drugs) and their effects are compared. Surprisingly, many of the subjects who took the placebo also felt their symptoms improved. This indicates that the patient's psychological state plays an important role in the success of the treatment. However, the placebo effect has its limitations. For example, it is difficult to obtain sufficient benefit from placebo alone for serious illnesses. Also, ethical issues may arise if patients are given placebos as “real drugs. Deliberately deceiving patients risks undermining the trusting relationship, and thus requires careful handling in the medical field. Nevertheless, the placebo effect has potential uses in medicine and psychotherapy. For example, it may augment treatment effects by creating positive expectations and increasing trust in patients. Furthermore, studying the placebo effect may lead to a better understanding of the mind-body relationship and the development of more effective therapies. The placebo effect is an important phenomenon that goes beyond mere “beliefs” and demonstrates the complex connections between human psychology and physiology. A better understanding of it could provide new perspectives in the fields of medicine and health.",
ブラックホール,Black Holes,science,B2,ブラックホールは、非常に強い重力を持つ天体であり、光さえも逃れることができない領域を形成しています。その起源は、大質量の星が超新星爆発を起こした後に残された核が、自身の重力によって圧縮されることにあります。この圧縮の結果、星の質量が非常に小さな空間に集中し、密度が無限大に近い「特異点」を形成します。ブラックホールの境界は「事象の地平面」と呼ばれ、これを越えた物質や光は、二度と外部に出ることができません。この特性のため、ブラックホールそのものは直接観測することができませんが、その周囲にあるガスや星の動き、または放出されるX線からその存在を間接的に確認することができます。ブラックホールは一般的に3つのタイプに分類されます。「恒星質量ブラックホール」は太陽の数倍から数十倍の質量を持つものです。「超大質量ブラックホール」は銀河の中心に存在し、太陽の数百万倍から数十億倍の質量を持ちます。さらに、「中間質量ブラックホール」という中規模のものも発見されていますが、その形成過程についてはまだ議論が続いています。ブラックホールの研究は、物理学や宇宙学の限界を探るための重要な分野です。特に、ブラックホールの特異点や事象の地平面における物理現象を理解することは、量子力学と一般相対性理論を統一する鍵になると考えられています。このように、ブラックホールの謎を解明することは、宇宙そのものを理解するための重要な一歩となるでしょう。,"A black hole is a celestial body with extremely strong gravity, forming a region from which even light cannot escape. Its origin lies in the compression of the nucleus left behind after a supernova explosion of a massive star by its own gravity. As a result of this compression, the star's mass is concentrated in a very small space, forming a singularity whose density is nearly infinite. The boundary of a black hole is called the event horizon, beyond which matter and light can never again exit. Because of this characteristic, the black hole itself cannot be directly observed, but its presence can be indirectly confirmed by the movement of gas and stars around it or by the X-rays it emits. Black holes are generally classified into three types. Stellar-mass black holes have masses several to several dozen times that of the Sun. Supermassive black holes exist at the centers of galaxies and are millions to billions of times more massive than the Sun. In addition, intermediate-mass black holes have been discovered, but the process of their formation is still under debate. The study of black holes is an important field for exploring the limits of physics and cosmology. In particular, understanding physical phenomena at the singularities and event horizons of black holes is believed to be the key to unifying quantum mechanics and general relativity. Thus, unraveling the mysteries of black holes will be an important step toward understanding the universe itself.",
