titleJapanese,titleEnglish,genre,CEFR,japanese,english,hiragana
Wi-Fiアクセスのお願い,Asking for Wi-Fi Access,dialogue,A1,田中さんはカフェに入ると、静かな席を見つけて座った。店内は落ち着いた雰囲気で、窓から入る日差しが心地よい。しかし、スマートフォンを取り出すと、インターネットの接続がうまくいかないことに気がついた。少し困った表情を浮かべながら、田中さんは店員に声をかけた。「すみません、ここにWi-Fiはありますか？」と、田中さんは丁寧に尋ねた。店員はにこやかに微笑みながら、「はい、ございます」と答えた。「Wi-Fiのパスワードはレシートに書いてあります。」「ありがとうございます」と言いながら、田中さんはテーブルに戻り、レシートを確認した。そこには「Wi-Fi Password: cafelife123」と書いてあった。スマートフォンに入力すると、すぐに接続できた。「よかった！」と小さく声を出し、田中さんは安心してコーヒーを飲みながら作業を始めた。,"Upon entering the cafe, Mr. Tanaka found a quiet seat and sat down. The atmosphere inside the restaurant was calm and the sunlight coming in through the window was pleasant. However, when he took out his smartphone, he noticed that his Internet connection was not working. With a slightly troubled expression on his face, Mr. Tanaka approached the clerk. Excuse me, do you have Wi-Fi here?” Mr. Tanaka asked politely. The clerk smiled and replied, “Yes, we do. The password for the Wi-Fi is on your receipt.” Saying, “Thank you,” Mr. Tanaka returned to the table and checked his receipt. On it was written “Wi-Fi Password: cafelife123. He typed it into his smartphone and was soon connected. ""Thank goodness,"" Mr. Tanaka said quietly and began to work while sipping his coffee.",たなかさんはかふぇにはいると、しずかなせきをみつけてすわった。てんないはおちついたふんいきで、まどからはいるひざしがここちよい。しかし、すまーとふぉんをとりだすと、いんたーねっとのせつぞくがうまくいかないことにきがついた。すこしこまったひょうじょうをうかべながら、たなかさんはてんいんにこえをかけた。「すみません、ここにWi-Fiはありますか？」と、たなかさんはていねいにたずねた。てんいんはにこやかにほほえみながら、「はい、ございます」とこたえた。「Wi-Fiのぱすわーどはれしーとにかいてあります。」「ありがとうございます」といいながら、たなかさんはてーぶるにもどり、れしーとをかくにんした。そこには「Wi-FiPassword:cafelife123」とかいてあった。すまーとふぉんににゅうりょくすると、すぐにせつぞくできた。「よかった！」とちいさくこえをだし、たなかさんはあんしんしてこーひーをのみながらさぎょうをはじめた。
発酵食品,Fermented Foods,food,C2,発酵食品は、微生物の働きを利用して食品を加工し、その栄養価や保存性、風味を高めたものを指します。日本においては、味噌や醤油、納豆、漬物などが代表的な発酵食品として広く知られています。これらの食品は、単なる調味料や副菜としての役割を超え、日本の食文化そのものを象徴する存在と言えます。発酵の過程では、酵母や乳酸菌、麹菌といった微生物が食品内の成分を分解します。その結果、アミノ酸や有機酸、アルコールといった新たな化学物質が生成され、食品の風味が深まり、独特の香りが生まれます。また、発酵によって栄養価が向上することも大きな特徴です。例えば、納豆に含まれるナットウキナーゼは血栓の予防に効果的とされ、味噌や醤油に含まれるグルタミン酸は、旨味成分として料理全体の味を引き立てます。さらに、発酵食品は保存性にも優れています。発酵により食品内のpHが低下し、腐敗菌の増殖を抑える効果が得られるため、冷蔵技術が発達していなかった時代から、貴重な保存食として重宝されてきました。特に日本では、塩や麹を利用した発酵技術が古くから発達し、地域ごとに異なる独自の発酵食品が生まれました。近年、発酵食品はその健康効果が再評価され、国内外で注目を集めています。腸内環境を整えるプロバイオティクスとしての効果や、免疫力の向上、さらにはメンタルヘルスへの好影響が研究によって明らかになっています。このように、発酵食品は科学的な視点からもその価値が証明されつつあります。総じて言えば、発酵食品は人間の知恵と自然の力が融合した結果生まれた、極めて優れた食品文化の一端を担っています。その多様性や深みを知ることは、私たちの食生活をより豊かにするだけでなく、伝統と現代科学の接点を理解する上でも重要な鍵となるでしょう。,"Fermented foods are foods that have been processed using the action of microorganisms to enhance their nutritional value, preservation, and flavor. In Japan, miso, soy sauce, natto, and pickles are widely known as typical fermented foods. These foods are more than just seasonings or side dishes; they are symbolic of Japanese food culture itself. During the fermentation process, microorganisms such as yeast, lactic acid bacteria, and koji mold break down the components in the food. As a result, new chemical substances such as amino acids, organic acids, and alcohol are produced, deepening the flavor of the food and giving it a distinctive aroma. Another important feature of fermentation is that it improves the nutritional value of the food. For example, nattokinase in natto is effective in preventing blood clots, and glutamic acid in miso and soy sauce enhances the overall flavor of food as a flavor enhancer. Furthermore, fermented foods have excellent preservation properties. Fermentation lowers the pH level in foods and suppresses the growth of putrefactive bacteria, making them valuable preservative foods since the days when refrigeration technology was not developed. In Japan in particular, fermentation techniques utilizing salt and koji have long been developed, giving rise to unique fermented foods that differ from region to region. In recent years, fermented foods have been reevaluated for their health benefits and are attracting attention both in Japan and abroad. Research has revealed their effects as probiotics that regulate the intestinal environment, improve immunity, and even have a positive impact on mental health. Thus, fermented foods are proving their value from a scientific perspective as well. All in all, fermented foods are part of an extremely fine food culture that is the result of the fusion of human wisdom and the power of nature. Understanding their diversity and depth will not only enrich our dietary life, but will also be key to understanding the interface between tradition and modern science.",
瞑想,Meditation,psychology,B2,瞑想とは、心を静め、意識を集中させることで心身の健康や精神的な安定を促進する行為である。現代社会では、仕事や人間関係のストレスが増大しており、多くの人々が瞑想を生活に取り入れるようになっている。その理由の一つは、瞑想が脳の働きに良い影響を与えるという科学的な証拠が増えていることだ。瞑想にはさまざまな方法があるが、一般的には静かな場所で目を閉じ、呼吸に意識を集中させることが多い。この過程で、雑念を手放し、現在の瞬間に意識を向けることが重要とされている。特に「マインドフルネス瞑想」は、自分の感覚や感情をそのまま受け入れることを重視しており、西洋でも広く普及している。瞑想を習慣化することで、ストレスの軽減や集中力の向上が期待できる。また、自己理解を深める手段としても有効だとされている。しかし、最初は思考を止めるのが難しく、集中が途切れやすいという課題もある。これを克服するには、毎日短時間でも継続することが鍵となる。瞑想は宗教的な実践に由来する場合も多いが、現在では宗教にとらわれず実践することが可能である。したがって、忙しい日常の中で心の平穏を取り戻す方法として、誰にでも取り入れやすい活動だと言える。,"Meditation is the act of quieting the mind and focusing the consciousness to promote mental and physical health and mental stability. In today's society, with the increasing stresses of work and relationships, many people are incorporating meditation into their lives. One reason for this is the growing body of scientific evidence that meditation has a positive effect on brain functioning. There are many different ways to meditate, but generally it involves closing one's eyes in a quiet place and focusing on one's breathing. During this process, it is considered important to let go of distractions and become aware of the present moment. Mindfulness meditation, in particular, emphasizes accepting one's sensations and emotions as they are, and is widely used in the West. Making meditation a habit can be expected to reduce stress and improve concentration. It is also considered an effective means of deepening self-understanding. However, at first it is difficult to stop thinking and it is easy to lose focus. The key to overcoming this is to continue to do so, even for a short time each day. Although meditation is often derived from religious practice, it can now be practiced without regard to religion. Therefore, it is an activity that anyone can easily adopt as a way to regain peace of mind in the midst of a busy daily routine.",
社会不安,Social Anxiety,psychology,B1,社会不安は、多くの人が経験する心の問題の一つです。特に、人前で話すことや、新しい人と出会うことが苦手だと感じる場合が多いです。この不安は、単なる緊張とは異なり、強い恐怖感やストレスを引き起こすことがあります。例えば、学校や職場で発言する時、心拍数が上がったり、汗をかいたりすることがあります。社会不安を感じる理由は人それぞれですが、過去の失敗や批判を受けた経験が原因になることがあります。また、周囲の評価を気にしすぎる性格も関係しています。このような不安は、日常生活や仕事に影響を与えることがあり、深刻な場合は専門的な支援が必要です。対策としては、自分を肯定する考え方を身につけることや、少しずつ人前で話す練習をすることが効果的です。また、友人や家族に相談することで気持ちが軽くなることもあります。社会不安を克服するには時間がかかりますが、小さな成功を積み重ねることが大切です。社会不安について理解を深めることで、周りの人を支える方法も見つかるでしょう。そして、誰もが安心して社会で生きられる環境を作ることが、私たちにとっての目標と言えます。,"Social anxiety is one of the most common psychological problems experienced by many people. In many cases, people feel especially uncomfortable with public speaking and meeting new people. This anxiety is different from mere nervousness and can cause intense fear and stress. For example, one may experience an increased heart rate or sweat when speaking up at school or work. People experience social anxiety for different reasons, but it can be caused by past experiences of failure or criticism. It can also be related to a personality that is overly concerned about what others think of them. Such anxiety can affect daily life and work, and in serious cases, professional help is needed. Effective countermeasures include developing a positive attitude toward oneself and gradually practicing public speaking. In addition, talking to friends and family may help to lighten the mood. Overcoming social anxiety takes time, but it is important to accumulate small successes. As you gain a better understanding of social anxiety, you will find ways to support those around you. And our goal is to create an environment where everyone can live in society with peace of mind.",
神道,Shinto,philosophy,C1,神道は、日本固有の宗教であり、古代から続く信仰の形態です。自然崇拝や祖先崇拝を基盤とし、多神教的な特徴を持っています。その中心には、神（かみ）と呼ばれる霊的存在への敬意と感謝の念があります。神道の神は、山や川、森、海といった自然界の要素だけでなく、歴史的な人物や土地にも宿るとされています。神道の重要な儀式には、祓いや祭りがあります。祓いは、穢れを清めるための儀式であり、神社で行われることが一般的です。一方、祭りは地域ごとに特徴があり、神を迎えるための踊りや音楽、行列などが含まれます。これらの祭りを通じて、人々は神と交流し、地域社会の結束を深めます。また、神社は神道の信仰の中心地です。鳥居をくぐることで、現世と神域の境界を越えるとされています。神社の境内には、拝殿や本殿、手水舎などがあり、訪れた人々はお参りや絵馬の奉納を行います。結婚式や七五三といった人生儀礼も、神道の神社で行われることが多いです。神道は宗教としての戒律や教典を持たないため、信仰の形は柔軟であり、他の宗教との共存が可能です。この特徴により、多くの日本人は神道を日常生活の一部として受け入れつつ、仏教やキリスト教の行事にも参加します。このような寛容性が、神道を現代の日本社会に深く根付かせている要因の一つといえるでしょう。神道を理解することは、日本の文化や価値観を理解するうえで重要です。自然と人間、そして目に見えない存在との調和を大切にする神道の精神は、今日でも日本人の生活や考え方に大きな影響を与えています。,"Shinto is a religion unique to Japan and a form of faith that has been practiced since ancient times. It is based on nature worship and ancestor worship, and is characterized as polytheistic. At its core is respect and gratitude for spiritual beings called kami, or gods. Shinto deities are believed to reside not only in natural elements such as mountains, rivers, forests, and oceans, but also in historical figures and lands. Important Shinto rituals include purification and festivals. Purification is a ceremony to cleanse the body of impurities and is usually held at shrines. Festivals, on the other hand, are unique to each region and include dancing, music, and processions to welcome the gods. Through these festivals, people interact with the deities and deepen community cohesion. Shrines are also centers of Shinto belief. It is believed that by passing through the torii gate, one crosses the boundary between this world and the Shinto realm. Within the shrine precincts are the hall of worship, the main hall of worship, and a water closet, where visitors pay their respects and offer votive votive ema (votive picture tablet). Life rituals such as weddings and Shichi-Go-San are also often held at Shinto shrines. Since Shinto does not have precepts or scriptures as a religion, the form of belief is flexible and can coexist with other religions. This characteristic allows many Japanese to accept Shinto as part of their daily lives while also participating in Buddhist and Christian observances. This tolerance is one of the factors that make Shinto deeply rooted in contemporary Japanese society. Understanding Shinto is important to understanding Japanese culture and values. The spirit of Shinto, which emphasizes harmony between nature, humans, and unseen entities, continues to have a profound influence on the way Japanese people live and think today.",
禅宗,Zen Buddhism,philosophy,B2,禅宗は日本の仏教の一派であり、特に「座禅」を中心とした修行方法で知られています。禅の起源は中国の禅宗にさかのぼり、日本には鎌倉時代に伝わりました。その後、臨済宗と曹洞宗が日本で広まり、それぞれ独自の特徴を持ちながら、今日に至るまで多くの人々に影響を与えています。禅の教えは、形式や理論を重視するのではなく、直接的な体験を通じて悟りを得ることを目的としています。例えば、「公案」と呼ばれる問いを通して、思考の枠を超えた直感的な理解を促す方法が有名です。また、日常生活の中に修行を取り入れることも重要とされ、「一日作さざれば一日食らわず」という言葉に象徴されるように、労働や日常の行いそのものが修行とみなされます。禅の精神は日本文化にも深く影響を与えました。茶道、庭園、書道などの伝統文化には、禅のシンプルさや自然との調和を重視する考え方が色濃く反映されています。そのため、禅は単なる宗教的な教義にとどまらず、日本人の美意識や価値観の形成にも寄与してきたと言えるでしょう。現代においても、禅の哲学は多くの人々に支持されています。ストレス社会と呼ばれる現代において、座禅による心の平穏を求める人々が増えており、世界中で禅が注目されています。このように、禅は古代から現代まで一貫して人々に深い洞察と安らぎを提供してきたのです。,"Zen Buddhism is a branch of Japanese Buddhism, particularly known for its practice centered on zazen (seated meditation). The origins of Zen can be traced back to the Zen sect in China, which was introduced to Japan in the Kamakura period (1185-1333). Subsequently, the Rinzai and Soto sects spread in Japan, each with its own unique characteristics, influencing many people to this day. Zen teachings do not emphasize formality or theory, but rather aim to attain enlightenment through direct experience. For example, it is famous for its method of encouraging intuitive understanding beyond the boundaries of thought through questions called koans. It is also important to incorporate training into daily life, and as symbolized by the phrase If you don't work for a day, you won't eat for a day, labor and daily activities themselves are considered training. The spirit of Zen has deeply influenced Japanese culture. Traditional cultures such as the tea ceremony, gardens, and calligraphy strongly reflect Zen's emphasis on simplicity and harmony with nature. Thus, Zen is more than just a religious doctrine; it has also contributed to the formation of the Japanese sense of beauty and values. Even today, the philosophy of Zen is supported by many people. In today's stressful society, Zen is attracting attention around the world as more and more people seek the peace of mind that comes from sitting in meditation. In this way, Zen has consistently provided people with deep insight and peace of mind from ancient times to the present.",
福岡,Fukuoka,travel,B1,福岡市は、九州地方で一番大きな都市で、日本だけでなくアジアからも多くの観光客が訪れる人気のある場所です。この都市は、歴史、自然、そして美味しい食べ物が楽しめることで有名です。まず、福岡は「太宰府天満宮」があることで知られています。この神社は学問の神様として知られる菅原道真を祀っており、多くの学生が合格祈願に訪れます。太宰府天満宮の参道では、「梅ヶ枝餅（うめがえもち）」という名物のお菓子を食べることができます。甘さ控えめでとても美味しいです。福岡市内では、「福岡タワー」や「大濠公園」などの観光スポットがあります。福岡タワーからは市内の景色や博多湾を見ることができ、夜景もとてもきれいです。大濠公園は緑が多く、散歩やジョギングにぴったりの場所です。福岡といえば、何といっても「屋台」が有名です。市内の川沿いや道路にはたくさんの屋台が並んでおり、ラーメン、焼き鳥、もつ鍋などの美味しい料理を楽しむことができます。特に「博多ラーメン」は福岡の名物で、濃厚な豚骨スープが特徴です。交通の便も良く、福岡空港は市内中心部から地下鉄でわずか10分という便利さです。そのため、国内外からのアクセスがとても簡単です。福岡は、歴史、自然、食文化が一度に楽しめる活気ある都市です。初めて九州を訪れるなら、ぜひ福岡を旅の目的地にしてみてください！,"Fukuoka City is the largest city in the Kyushu region and a popular destination for many tourists from Japan and Asia. This city is famous for its history, nature, and delicious food. First, Fukuoka is known for its Dazaifu Tenmangu Shrine. This shrine is dedicated to Sugawara Michizane, known as the god of learning, and many students visit to pray for success in their studies. On the approach to Dazaifu Tenmangu Shrine, visitors can eat a famous sweet called Umegae mochi (plum cake). It is very tasty and not too sweet. In Fukuoka City, there are many sightseeing spots such as Fukuoka Tower and Ohori Park. From Fukuoka Tower, you can see the city and Hakata Bay, and the night view is very beautiful. Ohori Park has a lot of greenery and is a great place for strolling or jogging. Fukuoka is famous for its yatai, or food stalls. Many yatai stalls line the riverside and streets of the city, where you can enjoy delicious dishes such as ramen, yakitori, and motsunabe. Hakata Ramen in particular is a specialty of Fukuoka, characterized by its rich pork bone soup. Transportation is also convenient, with Fukuoka Airport only a 10-minute subway ride from the city center. This makes it very easy to access from both Japan and overseas. Fukuoka is a vibrant city where you can enjoy history, nature, and food culture all at once. If you are visiting Kyushu for the first time, make Fukuoka your travel destination!",
