titleJapanese,titleEnglish,genre,CEFR,japanese,english,hiragana
ウィキッド後編,"Wicked, Part II",fantasy,B1,幕が上がると、エルファバはすでにオズ国中で「邪悪な魔女」として恐れられ、追われる身となっています。一方で、グリンダは「良い魔女」として尊敬される存在になり、オズの魔法使いと協力してエルファバを捕まえようとしています。二人はかつて親友でしたが、今では敵同士のような立場です。それぞれの選んだ道が二人を引き裂いているのです。エルファバは愛するフィエロと再会します。フィエロはグリンダの婚約者でしたが、エルファバの強さと正義感に惹かれ、彼女を選びます。このことでグリンダは心の奥底で深い悲しみを抱きますが、それを隠し、自分の使命に集中します。やがてエルファバは、自分の妹ネッサローズを助けようとしますが、計画は失敗し、ネッサローズは亡くなってしまいます。この出来事はエルファバの心をさらに傷つけ、彼女を孤独にします。ネッサローズの死の責任をエルファバに押し付けられ、彼女の評判はますます悪くなります。一方、グリンダとエルファバは対決の時を迎えます。しかし、二人の間にはまだかつての友情がわずかに残っていることが分かります。二人は心の底でお互いを大切に思っているのです。しかし、世界が彼女たちを分かつのです。最後に、エルファバはフィエロと一緒に逃げるため、自分が「死んだ」と思わせる作戦を立てます。これにより彼女は自由を手に入れますが、世間には「悪い魔女が滅びた」という話が広まります。グリンダは一人、オズの世界を守る役割を果たすことを選びますが、心の中にはエルファバへの複雑な感情が残っています。物語はここで終わりますが、エルファバとグリンダが示す友情や選択の物語は、観客に深い余韻を残します。それぞれが正義を信じ、それぞれが愛を守ろうとした結果、全く異なる道を歩むことになったのです。,"When the curtain rises, Elphaba is already feared and hunted as the Wicked Witch throughout Oz. On the other hand, Glinda has become a respected good witch and is working with the Wizard of Oz to capture Elphaba. They were once best friends, but now they are enemies. Their respective paths have torn them apart. Elphaba is reunited with her beloved  Fiyero.  Fiyero was Glinda's fiancée, but he chooses her because of Elphaba's strength and sense of justice. This causes Glinda deep sorrow in her heart, but she hides it and focuses on her mission. Eventually, Elphaba tries to save his sister Nessarose, but the plan fails and Nessarose dies. This event further breaks Elphaba's heart and leaves her alone. Elphaba is blamed for Nessarose's death, and her reputation is further tarnished. Meanwhile, Glinda and Elphaba face off. However, it turns out that there is still a small amount of their former friendship between them. Deep down, they still care about each other. But the world divides them. Finally, in order to escape with  Fiyero, Elphaba devises a plan to make him think she is dead. This gives her her freedom, but the world spreads the story that the Wicked Witch has died. Glinda alone chooses to play a role in protecting the world of Oz, but in her heart she still has mixed feelings for Elphaba. The story ends here, but the tale of friendship and choice shown by Elphaba and Glinda leaves a deep lingering impression on the audience. Each believes in justice, and each has taken very different paths as a result of their attempts to protect their love.",
源氏物語,The Tale of Genji,drama,C1,平安時代の貴族社会を舞台に、紫式部が描き上げた『源氏物語』。これは、一人の光り輝く若者、光源氏の波乱に満ちた生涯と、彼を取り巻く人々の恋や運命の物語です。光源氏、その名の通り、まるで月の光のように美しく、才気あふれる若者。けれど、その輝きゆえに、彼の人生には影が差し込むことも少なくありません。彼は帝の寵愛を受ける桐壺更衣の息子として生まれました。しかし、母親は他の后たちの嫉妬に苦しみ、若くしてこの世を去ります。この出来事が、源氏の人生の最初の試練でした。源氏が成長するにつれて、彼は宮中でも町中でもその魅力で人々を虜にしていきます。けれども、彼の恋愛は単なる華やかな冒険ではありません。それは時に苦悩を伴うものでした。たとえば、若き日に恋した藤壺という女性。彼女は実は源氏の義母でありながら、互いに惹かれ合う宿命の相手でした。しかし、その禁断の恋から生まれた子供の存在が、源氏にとっては人生最大の秘密となるのです。恋愛だけではなく、源氏は政治的な波にも翻弄されます。若くして身分を落とされ、須磨や明石といった辺鄙な地に流されることもありました。その地での出会いや経験が、彼をより成熟した人間へと成長させていきます。そして、彼が京都へ戻ったとき、再びその輝きを取り戻し、六条院という豪華な邸宅を築き、多くの女性たちとの関係を築いていきます。その中でも特に有名なのが、紫の上との物語。彼女は源氏が幼い頃から育て上げた女性で、やがて彼の心の支えとなる存在です。しかし、その愛情は必ずしも平穏なものではありませんでした。嫉妬や悲しみ、そして紫の上の病が、源氏の人生に深い影響を及ぼします。やがて、物語の後半に入ると、源氏の物語から次の世代へと焦点が移ります。彼の息子や孫たちの恋模様が描かれ、物語は静かに幕を閉じます。その終わり方は、まるで朧月のように曖昧で、読者の心に深い余韻を残します。,"The Tale of Genji is set in the aristocratic society of the Heian period and was written by Murasaki Shikibu. It is the story of the tumultuous life of Hikaru Genji, a brilliant young man, and the love and destiny of the people around him. Hikaru Genji, as his name suggests, is a beautiful and brilliant young man, like the light of the moon. However, his brilliance often casts a shadow over his life. He was born the son of the emperor's favorite, Kiritsubo Sarai. His mother, however, suffered from the jealousy of other empresses and died at a young age. This event was the first trial of Genji's life. As Minamoto grew up, he captivated people with his charm, both at court and in town. But his love life was not just a glamorous adventure. It was sometimes painful. For example, he fell in love with a young woman named Fujitsubo. She was actually Genji's mother-in-law, but they were destined to be attracted to each other. However, the child born of this forbidden love would become the biggest secret of Genji's life. In addition to love, Genji was also tossed about by political waves. At a young age, he was reduced to a lowly position and sometimes exiled to remote places such as Suma and Akashi. His encounters and experiences there helped him grow into a more mature person. When he returned to Kyoto, he once again regained his brilliance, built a luxurious residence called Rokujoin, and established relationships with many women. One of the most famous of these is the story with Murasaki no Ue. She is the woman whom Genji raises from an early age and who eventually becomes his emotional support. However, their love was not always peaceful. Jealousy, grief, and Murasaki no Ue's illness have a profound effect on Genji's life. Eventually, as we enter the second half of the story, the focus shifts from Genji's story to the next generation. The story quietly comes to a close with the love stories of his sons and grandchildren. The ending is as ambiguous as a hazy moon, leaving a deep aftertaste in the reader's mind.",
幸福の心理,The Psychology of Happiness,psychology,B1,幸福とは、多くの人が追い求める大切なものです。しかし、幸福を感じる理由や方法は人によって異なります。心理学では、幸福にはいくつかの要素があると考えられています。例えば、良い人間関係、目的を持つこと、自分を大切にすることなどが挙げられます。まず、人間関係は幸福に大きな影響を与えます。家族や友達との絆が強いと、安心感や喜びを感じることができます。また、他人を助けたり感謝の気持ちを表したりすることも、自分の幸福感を高めると言われています。次に、目標を持つことも重要です。たとえ小さな目標でも、それを達成することで達成感や満足感が得られます。目標に向かって努力する過程そのものが、幸福感を生み出すこともあります。さらに、自分の健康や感情を大切にすることも幸福に繋がります。ストレスを減らすために趣味を楽しんだり、自然の中で過ごしたりするのは良い方法です。また、自分の成功や努力を認めることも、自信や幸福感を高めると言えます。幸福の心理を理解することで、自分に合った幸せの作り方を見つけることができます。一人ひとりが自分らしい幸福を追求することが、豊かな人生に繋がるのではないでしょうか。,"Happiness is an important thing that many people pursue. However, why and how we feel happiness varies from person to person. Psychology believes that happiness has several components. For example, good relationships, having a purpose, and taking care of yourself. First, relationships have a significant impact on happiness. Strong bonds with family and friends can make us feel secure and joyful. Helping others and expressing gratitude are also said to enhance one's sense of well-being. Second, it is also important to have goals. Achieving even the smallest of goals gives us a sense of accomplishment and satisfaction. The process of working toward a goal itself can also create a sense of well-being. Furthermore, taking care of one's health and emotions also leads to happiness. Enjoying hobbies and spending time in nature are good ways to reduce stress. Recognizing one's successes and efforts can also increase one's self-confidence and happiness. By understanding the psychology of happiness, you can find a way to create happiness that works for you. I believe that each of us pursuing our own unique happiness will lead to a rich life.",
広島,Hiroshima,travel,B1,広島市は、日本の中国地方にある大きな都市で、平和と歴史を学ぶのにとても重要な場所です。この都市は、1945年に原爆が投下されたことで世界的に知られています。その悲劇を忘れないために、「平和記念公園」と「原爆ドーム」が作られました。原爆ドームは、戦争の恐ろしさと平和の大切さを伝える世界遺産として登録されています。平和記念公園では、平和記念資料館を訪れることができます。館内では、原爆の被害やその後の復興について学ぶことができます。また、毎年8月6日には「平和記念式典」が行われ、多くの人々が平和への祈りを捧げます。広島には、他にもたくさんの観光スポットがあります。例えば、「宮島」にある厳島神社はとても有名です。この神社の赤い大鳥居が海に浮かんでいる景色は、まるで絵のように美しいです。宮島では鹿に出会うこともできます。さらに、広島の名物料理「お好み焼き」もぜひ味わってください。他の地域のお好み焼きと比べて、広島のお好み焼きは麺が入っているのが特徴です。ボリュームがあり、とてもおいしいです。広島は、歴史を学びながら自然や文化も楽しめる魅力的な都市です。一度訪れると、忘れられない体験ができるでしょう。,"Hiroshima is a large city in the Chugoku region of Japan and a very important place for learning about peace and history. This city is known worldwide for the atomic bombing in 1945. To remember the tragedy, Peace Memorial Park and Atomic Bomb Dome were built. The Atomic Bomb Dome is registered as a World Heritage Site that conveys the horror of war and the importance of peace. In Peace Memorial Park, visitors can visit the Peace Memorial Museum. Inside the museum, visitors can learn about the damage caused by the atomic bomb and the subsequent reconstruction. Also, every year on August 6, the Peace Memorial Ceremony is held and many people offer prayers for peace. There are many other tourist attractions in Hiroshima. For example, Itsukushima Shrine on Miyajima is very famous. The view of the red Otorii (Grand Gate) of this shrine floating on the sea is as beautiful as a painting. You can also see deer on Miyajima. In addition, be sure to try Hiroshima's famous dish, okonomiyaki. Compared to okonomiyaki in other regions, Hiroshima's okonomiyaki is characterized by the inclusion of noodles. It is hearty and very tasty. Hiroshima is a fascinating city where you can enjoy nature and culture while learning about history. Once you visit, you will have an unforgettable experience.",
洋服の買い物,Shopping for Clothes,dialogue,A2,"店のドアを開けると、明るい音楽が流れていた。春子は店内を見回して、セールの看板を見つけた。「いらっしゃいませ！」と店員が笑顔で声をかける。「今日は何をお探しですか？」春子は少し緊張しながら答えた。「えっと、春用のジャケットを探しています。」「春用のジャケットですね。こちらに色々ございます。」店員は春子を棚の方へ案内した。「こちらのコーナーはセール品です。こちらは新作です。」春子はセール品を手に取り、値段のタグを見た。「これ、ちょっと安いですね。でも色がちょっと派手かもしれません。」「確かに明るい色ですね。」店員はうなずきながら別のジャケットを取った。「こちらはもう少し落ち着いた色ですし、サイズも調整しやすいです。」春子はそれを手に取り、鏡の前に立った。「あ、これいい感じですね。値段も手頃です。」「似合っていますよ。」店員は嬉しそうに言った。「試着室はあちらです。ご試着なさいますか？」春子は頷き、ジャケットを持って試着室に入った。少しして試着室のカーテンを開けると、店員が笑顔で待っていた。「いかがですか？」「ぴったりです！これにします。」春子は嬉しそうに言った。「ありがとうございます！レジにご案内します。」店員はレジへ向かいながら付け加えた。「お会計の際に、メンバーズカードをお持ちでしたら、さらに10%オフになりますよ。」春子は財布を開けてカードを探した。「あ、持っています！それなら助かります。」「ありがとうございます。それでは、お会計は税込みで7,200円になります。」店員がレジで対応する間、春子は次の買い物のことを考えていた。袋を受け取り、春子は「ありがとうございました！」と明るく挨拶をして店を出た。新しいジャケットに春の風がぴったり合いそうだと感じた。","When she opened the door of the store, bright music was playing. Haruko looked around the store and spotted a sale sign. Welcome!” the clerk said with a smile. What can I help you with today?” Haruko answered a little nervously. I'm looking for a spring jacket. A spring jacket, yes. We have a variety here. The clerk led Haruko to a shelf. This section is for sale. Here are our new items. Haruko picked up a sale item and looked at the price tag. This is a little cheap,” she said. But the colors might be a bit gaudy. Haruko nodded and looked at the price tag. The clerk nodded and took another jacket. This one is a bit more subdued, and the size is more adjustable.” Haruko took it and stood in front of the mirror. This one looks great,” she said, ”and the price is reasonable. The price is reasonable. It looks good on you. The clerk said happily. The fitting room is over there. Would you like to try it on? Haruko nodded and entered the fitting room with the jacket. A few moments later, she opened the curtains of the fitting room and found the clerk waiting for her with a smile on her face. How do you like it? It fits perfectly! I'll take this one. Haruko said happily. Thank you very much! Let me show you to the cash register.” The clerk added as she walked to the register. If you have your member's card with you when you pay, you can get an extra 10% off.” Haruko opened her wallet and looked for her card. I have it! That would be very helpful. Thank you very much. Your bill, including tax, will be 7,200 yen. While the clerk worked the register, Haruko thought about her next purchase. Receiving the bag, Haruko cheerfully said, “Thank you very much! and left the store with a cheerful greeting. She felt the spring breeze would go perfectly with her new jacket.",
恐竜,Dinosaurs,science,A2,恐竜は、昔の地球に住んでいた大きな生き物です。約2億3千年前から6千5百万年前まで生きていました。その後、大きな隕石が地球にぶつかり、ほとんどの恐竜は絶滅しました。恐竜にはいろいろな種類がありました。草を食べる恐竜と肉を食べる恐竜がいました。例えば、ブラキオサウルスは長い首を持つ草食動物でした。一方、ティラノサウルスは鋭い歯を持つ肉食動物で、とても強かったと言われています。恐竜の化石は、世界中で見つかります。化石を研究することで、恐竜の体や生活について少しずつ分かってきました。今でも新しい化石が見つかり、恐竜の秘密が解き明かされています。恐竜は私たちにはもういませんが、その存在はとても興味深いです。映画や本でも恐竜の物語がたくさんあります。恐竜は多くの人にとって夢とロマンの象徴です。,"Dinosaurs are large creatures that lived on Earth a long time ago. They lived from about 230 million to 65 million years ago. Later, a large meteorite hit the earth and most of the dinosaurs became extinct. There were many different kinds of dinosaurs. There were grass-eating dinosaurs and meat-eating dinosaurs. For example, Brachiosaurus was a herbivore with a long neck. On the other hand, Tyrannosaurus was a carnivore with sharp teeth and is said to have been very strong. Dinosaur fossils are found all over the world. By studying fossils, we are gradually learning more about the bodies and lives of dinosaurs. Even now, new fossils are being found and the secrets of dinosaurs are being revealed. Although dinosaurs are no longer with us, their existence is still very interesting. There are many stories about dinosaurs in movies and books. Dinosaurs are a symbol of dreams and romance for many people.",
懐石,Kaiseki,food,C1,懐石料理は、日本の伝統的な高級料理であり、季節感や美意識を重視した料理形式として知られています。この料理は、もともと茶道と深く結びついて発展しました。禅の精神に基づく「簡素でありながら心を満たす」という理念が、懐石の根底にあります。懐石料理の特徴は、旬の食材を最大限に活かし、一品一品が丁寧に調理されている点です。器の選び方や盛り付けにも細心の注意が払われ、それぞれの料理が美術品のような趣を持っています。また、料理の順序や分量も計算されつくしており、食べる人が食事の流れを通じて満足感を得られるよう工夫されています。懐石料理は一般的に、前菜、椀物、刺身、焼き物、煮物、揚げ物、御飯、香の物、デザートという順で提供されます。この構成には、料理人の技術やセンスが凝縮されており、食材の調和や料理全体のバランスが極めて重要視されます。例えば、夏には涼しさを感じさせる器や、冬には温かみのある素材を使うなど、季節に応じた演出も魅力の一つです。さらに、懐石料理は単に食事をするだけでなく、食文化そのものを体験する場とも言えます。料理を口に運ぶ前に、その見た目や香りを楽しむことが奨励されます。これは「五感で味わう」という日本料理特有の考え方を反映しているものです。現在、懐石料理は茶会だけでなく、高級料亭やホテルのレストランでも提供され、国内外の人々から高い評価を受けています。その繊細な味わいや美しさは、まさに日本文化の粋と言えるでしょう。懐石料理を通じて、日本人の自然や四季への感謝の念、美に対する深い感性を感じ取ることができるのではないでしょうか。,"Kaiseki cuisine is a traditional Japanese haute cuisine, a culinary form known for its emphasis on seasonality and aesthetics. This cuisine originally developed in deep connection with the tea ceremony. Kaiseki is rooted in the Zen philosophy of “simplicity yet filling the heart. Kaiseki cuisine is characterized by the careful preparation of each dish, making the most of seasonal ingredients. Careful attention is also paid to the choice of utensils and serving style, giving each dish the appearance of a work of art. The order and quantity of dishes are also carefully calculated to ensure that the eater feels a sense of satisfaction throughout the meal. Kaiseki cuisine is generally served in the following order: appetizer, soup, sashimi, grilled dish, simmered dish, fried dish, rice, pickles, and dessert. The chef's skill and sense of taste are concentrated in this composition, and the harmony of ingredients and the overall balance of the dish are extremely important. Another appeal of kaiseki cuisine is its seasonal presentation, for example, the use of dishes that evoke coolness in the summer and warmth in the winter. Furthermore, kaiseki cuisine is not only a meal, but also an opportunity to experience the culinary culture itself. Before bringing a dish to your mouth, you are encouraged to enjoy its appearance and aroma. This reflects the unique concept of Japanese cuisine of “tasting with all five senses. Today, kaiseki cuisine is served not only at tea ceremonies but also at high-end ryotei (Japanese-style restaurants) and hotel restaurants, where it is highly appreciated by people in Japan and abroad. Its delicate flavor and beauty are truly the essence of Japanese culture. Through kaiseki cuisine, one can sense the Japanese people's appreciation for nature and the four seasons, as well as their deep sensitivity to beauty.",
折り紙,Origami,culture,A2,折り紙は日本の伝統的な紙を使ったアートです。紙を切らずに折ることで、さまざまな形を作ります。たとえば、鶴、カエル、箱などがあります。折り紙を始めるには、正方形の紙が必要です。色がついた紙を使うと、作品がもっときれいになります。折り紙は子どもから大人まで楽しめる趣味です。学校や家で折り紙を作る人が多いです。また、特別な行事でも折り紙を使います。たとえば、七夕では星や笹飾りを作ります。折り紙をすることで、手先が器用になり、集中力も高まります。最近では、世界中で折り紙が人気です。いろいろなデザインや折り方がインターネットで見つかります。折り紙を通して日本文化を知ることができるので、とても良い趣味です。,"Origami is a traditional Japanese art form using paper. By folding paper without cutting it, various shapes are created. Examples include cranes, frogs, and boxes. To start origami, you will need a square piece of paper. If you use colored paper, your work will be more beautiful. Origami is a hobby that can be enjoyed by both children and adults. Many people make origami at school or at home. Origami is also used for special events. For example, at Tanabata, people make stars and bamboo branch decorations. Doing origami helps children become more dexterous with their hands and improve their concentration. Recently, origami has become popular all over the world. Various designs and folding techniques can be found on the Internet. It is a great hobby because you can learn about Japanese culture through origami.",
